{
  "name": "savepoint",
  "version": "1.1.0",
  "description": "Save session context and git snapshots — your video game save point for agent work",
  "author": {
    "name": "Kanyini"
  },
  "tier": "T1",
  "requires": [],
  "recommends": [],
  "prereqs": {
    "mcps": [],
    "clis": [
      "git"
    ],
    "envVars": [],
    "services": []
  }
}
