{
  "name": "webinar-dev-bot",
  "version": "1.1.1",
  "description": "Build high-converting webinar presentations (HTML deck + Gemini slide art) from Offer Optimizer + Propaganda Machine data, then deliver them into Canva as an editable deck",
  "author": {
    "name": "Kanyini"
  },
  "tier": "T7",
  "requires": [],
  "recommends": [
    {
      "name": "offer-optimizer",
      "version": "^1.0.0"
    },
    {
      "name": "propaganda-machine",
      "version": "^1.0.0"
    },
    {
      "name": "webinar-forge",
      "version": "^1.0.0"
    },
    {
      "name": "vsl-activator",
      "version": "^2.0.0"
    }
  ],
  "prereqs": {
    "mcps": [],
    "clis": [
      "python3"
    ],
    "envVars": [],
    "services": [
      "Google AI Studio (Gemini API key)",
      "Canva"
    ]
  }
}
