{
  "name": "skill-to-site",
  "version": "1.0.0",
  "description": "Turn any installed skill into a deployed Vercel chat site (Next.js + streaming Anthropic API + secret-safe env piping)",
  "author": {
    "name": "Kanyini"
  },
  "tier": "T4",
  "requires": [],
  "recommends": [],
  "prereqs": {
    "mcps": [],
    "clis": [
      "npx",
      "node"
    ],
    "envVars": [],
    "services": [
      "Vercel",
      "Anthropic"
    ]
  }
}
